{
    "title": "",
    "description": "",
    "publisher": {
        "name": "",
        "mbox": ""
    },
    "superThemeTaxonomy": "",
    "dataset": [
        {
            "title": "",
            "description": "",
            "publisher": {
                "name": ""
            },
            "superTheme": [],
            "accrualPeriodicity": "",
            "issued": "",
            "distribution": [
                {
                    "accessURL": "",
                    "downloadURL": "",
                    "title": "",
		    "issued": ""
		}
            ]
        }
    ]
}
